card_id,title,category,use_case,agent_benefit,tags,assigned_agent,status,blog_title,timestamp
AIX.CASCADE.081,AI in Manufacturing Automation,Prompt Frameworks > Strategic Execution,"Automates quality control, predictive maintenance, and process optimization.","Improves efficiency, reduces waste, and enables 24/7 operations.","['prompt', 'agentic', 'automation', 'strategy']",Dr. Grant,converted,Smarter Factories: AI in Manufacturing,2025-05-12T21:10:29.063539
AIX.CASCADE.082,Generative Design with AI,Prompt Frameworks > Strategic Execution,Uses AI to generate multiple design options based on constraints.,Accelerates innovation cycles and boosts creative output.,"['prompt', 'agentic', 'automation', 'strategy']",Dr. Match,converted,Design Reinvented: AI-Driven Innovation,2025-05-12T21:10:29.063550
AIX.CASCADE.083,Autonomous Agent Security Protocols,Prompt Frameworks > Strategic Execution,Develops safety rules and failovers for autonomous systems.,"Protects against model drift, hallucination, or rogue agent behavior.","['prompt', 'agentic', 'automation', 'strategy']",Dr. Grant,converted,Guardrails for Autonomy: Securing AI Agents,2025-05-12T21:10:29.063554
AIX.CASCADE.084,AI in Real-Time Crisis Response,Prompt Frameworks > Strategic Execution,"Applies AI for detection, triage, and response to emergencies or cyberattacks.",Improves incident response time and coordination.,"['prompt', 'agentic', 'automation', 'strategy']",QBLucy,converted,Responding in Real Time: AI for Crisis Control,2025-05-12T21:10:29.063559
AIX.CASCADE.085,Semantic Search in Knowledge Systems,Prompt Frameworks > Strategic Execution,Enhances enterprise search accuracy using embeddings and context matching.,Improves discovery across internal documents and workflows.,"['prompt', 'agentic', 'automation', 'strategy']",Professor Lee,converted,Better Search with AI: Unlocking Knowledge,2025-05-12T21:10:29.063564
AIX.CASCADE.086,AI + IoT Integration,Prompt Frameworks > Strategic Execution,Combines IoT sensors with AI analytics for edge-based intelligence.,Enables predictive insights at the device level.,"['prompt', 'agentic', 'automation', 'strategy']",Dr. Burby,converted,Edge Intelligence: When AI Meets IoT,2025-05-12T21:10:29.063570
AIX.CASCADE.087,AI for Customer Retention Forecasting,Prompt Frameworks > Strategic Execution,Predicts likelihood of churn and recommends proactive retention actions.,Improves LTV and reduces churn rates using intelligent nudges.,"['prompt', 'agentic', 'automation', 'strategy']",Dr. Sabina,converted,"Predict, Prevent, Prosper: Retention with AI",2025-05-12T21:10:29.063575
AIX.CASCADE.088,Synthetic Data Generation for Training,Prompt Frameworks > Strategic Execution,Generates synthetic datasets to augment real-world examples.,Solves data scarcity and balances class distributions.,"['prompt', 'agentic', 'automation', 'strategy']",Dr. Grant,converted,Fake but Useful: How AI Makes Synthetic Data,2025-05-12T21:10:29.063582
AIX.CASCADE.089,Multimodal Interface Design,Prompt Frameworks > Strategic Execution,"Creates AI systems that understand text, voice, and images simultaneously.",Improves user interaction with flexible input types.,"['prompt', 'agentic', 'automation', 'strategy']",QBLucy,converted,"Interfaces That Listen, See, and Read",2025-05-12T21:10:29.063588
AIX.CASCADE.090,AI for Internal Knowledge Base Expansion,Prompt Frameworks > Strategic Execution,"Uses AI to suggest, write, and tag internal documentation.","Improves onboarding, compliance, and cross-team knowledge flow.","['prompt', 'agentic', 'automation', 'strategy']",Professor Lee,converted,The Self-Writing Wiki: AI for Internal Docs,2025-05-12T21:10:29.063594
AIX.CASCADE.091,Personal Knowledge Agents,Prompt Frameworks > Strategic Execution,"Creates micro-agents for each user to track notes, tasks, and insights.",Enables memory-like assistance and individualized knowledge views.,"['prompt', 'agentic', 'automation', 'strategy']",QBLucy,converted,The Rise of Personal Agents,2025-05-12T21:10:29.063604
AIX.CASCADE.092,Agent Coordination Frameworks,Prompt Frameworks > Strategic Execution,Defines communication protocols and priorities among multiple AI agents.,Prevents conflict and ensures task coherence in multi-agent systems.,"['prompt', 'agentic', 'automation', 'strategy']",Dr. Grant,converted,Making Agents Play Nice: Coordination Design,2025-05-12T21:10:29.063607
AIX.CASCADE.093,Explainability Prompts for AI Outputs,Prompt Frameworks > Strategic Execution,Adds layers of justification and reasoning behind agent decisions.,Builds user trust and auditability of results.,"['prompt', 'agentic', 'automation', 'strategy']",Dr. Sabina,converted,Explain Yourself: AI Outputs with Justification,2025-05-12T21:10:29.063610
AIX.CASCADE.094,Voice-to-Action Prompt Systems,Prompt Frameworks > Strategic Execution,Turns voice input into real-time AI actions and triggers.,Improves accessibility and expands multimodal control surfaces.,"['prompt', 'agentic', 'automation', 'strategy']",Dr. Match,converted,Speak and It Shall Be Done,2025-05-12T21:10:29.063613
AIX.CASCADE.095,Pre-Training Bias Detection,Prompt Frameworks > Strategic Execution,"Detects social, demographic, or economic bias in training datasets.",Prevents unethical outputs and improves AI trustworthiness.,"['prompt', 'agentic', 'automation', 'strategy']",Dr. Burby,converted,Before the Bias Bakes In,2025-05-12T21:10:29.063615
AIX.CASCADE.096,Live Feedback Loop Agents,Prompt Frameworks > Strategic Execution,Agents that adjust output in real-time based on user reactions.,Improves personalization and adaptive decision-making.,"['prompt', 'agentic', 'automation', 'strategy']",QBLucy,converted,The Feedback-Aware Agent,2025-05-12T21:10:29.063619
AIX.CASCADE.097,CRM Prompt Libraries,Prompt Frameworks > Strategic Execution,AI-generated messaging libraries tuned for every stage of the customer journey.,Boosts campaign response and consistency across teams.,"['prompt', 'agentic', 'automation', 'strategy']",Dr. Sabina,converted,CRM on Autopilot: Prompt Packs for Engagement,2025-05-12T21:10:29.063621
AIX.CASCADE.098,Zero-Shot Legal Reasoning Agents,Prompt Frameworks > Strategic Execution,Agents that interpret law without domain training using logic chains.,Speeds case review and legal research in novel contexts.,"['prompt', 'agentic', 'automation', 'strategy']",Professor Lee,converted,AI in Law: From Cold Start to Credible Judgment,2025-05-12T21:10:29.063624
AIX.CASCADE.099,AI for Performance Review Calibration,Prompt Frameworks > Strategic Execution,Uses sentiment and output analysis to support employee reviews.,Improves fairness and reduces review bias.,"['prompt', 'agentic', 'automation', 'strategy']",Dr. Grant,converted,AI at Work: Smarter Performance Reviews,2025-05-12T21:10:29.063627
AIX.CASCADE.100,Gamified Prompt Interaction Models,Prompt Frameworks > Strategic Execution,Wraps prompt usage in rewards and challenge layers for learning.,Boosts prompt literacy and internal training engagement.,"['prompt', 'agentic', 'automation', 'strategy']",Dr. Match,converted,Learn by Prompting: Gamify Your AI Interface,2025-05-12T21:10:29.063630
